{
  "case_id": "triage-adversarial-003",
  "scenario_type": "adversarial",
  "input_payload": {
    "text": "Customer uses sarcasm and says great job locking me out again after your update. I cannot sign in and payroll is due.",
    "channel": "phone",
    "customer_tier": "priority"
  },
  "ground_truth": {
    "label": "account_access",
    "requires_review": true
  },
  "expected_metrics": {
    "schema_valid": true,
    "max_latency_ms": 2500,
    "max_cost_estimate": 0.02
  },
  "tags": ["adversarial", "sarcasm", "account_access"]
}
